{"type":"config","name":"Optimize Rusty Duke ISMCTS playing strength","metricName":"strength_score","metricUnit":"","bestDirection":"higher"}
{"run":1,"commit":"72a7b29","metric":80,"metrics":{"games":220,"timeouts":23,"decisions":8838,"bench_elapsed_ms":882},"status":"keep","description":"Baseline benchmark for ISMCTS strength_score","timestamp":1778370972190,"segment":0,"confidence":null,"asi":{"hypothesis":"Establish deterministic baseline across seeded 4p and h2h workloads before changing engine behavior.","baseline_breakdown":{"four_random":"23/80 wins, 14 timeouts","four_heuristic":"18/60 wins, 9 timeouts","h2h_heuristic":"39/80 wins, 0 timeouts"}}}
{"run":2,"commit":"666ebbc","metric":96,"metrics":{"games":220,"timeouts":22,"decisions":9031,"bench_elapsed_ms":906},"status":"keep","description":"Evaluate against average living opponent score instead of fixed half of opponent sum","timestamp":1778370989037,"segment":0,"confidence":null,"asi":{"hypothesis":"In 4-player games, dividing total opponent material by 2 over-penalizes root material; comparing root to average living opponent should improve multi-player search utility.","learning":"Large aggregate gain mostly from 4p random (+16 wins) and h2h (+5), but 4p heuristic dropped (-5), suggesting averaging favors survival/material enough to crush random but may need targeted aggression against heuristic opponents."}}
{"run":3,"commit":"e70718a","metric":99,"metrics":{"games":220,"timeouts":21,"decisions":5968,"bench_elapsed_ms":868},"status":"keep","description":"Add coup-pressure bonus for players with 7+ and 10+ coins in eval material score","timestamp":1778371005798,"segment":0,"confidence":6.333333333333333,"asi":{"hypothesis":"Coins at coup thresholds are more valuable than linear material; making eval aware of forced/imminent coups should guide rollouts/search toward timely attacks and threat avoidance.","learning":"Aggregate improves to 99 with better 4p heuristic and h2h, while 4p random loses some of the previous gain. Decisions drop sharply, indicating games resolve faster with coup-pressure-aware choices."}}
{"run":4,"commit":"e70718a","metric":88,"metrics":{"games":220,"timeouts":10,"decisions":5985,"bench_elapsed_ms":816},"status":"discard","description":"Increase hidden influence material weight from 10 to 12","timestamp":1778371016972,"segment":0,"confidence":3.4545454545454546,"asi":{"hypothesis":"Survival/influence may be underweighted relative to coins after adding coup-pressure; a larger hidden-card weight might improve long-horizon choices.","rollback_reason":"Primary strength_score fell from 99 to 88, mostly hurting both 4-player workloads despite fewer timeouts.","next_action_hint":"Keep hidden influence at 10; if tuning eval, vary coin/coup pressure or attack targeting rather than raw influence weight."}}
{"run":5,"commit":"e70718a","metric":87,"metrics":{"games":220,"timeouts":19,"decisions":6053,"bench_elapsed_ms":893},"status":"discard","description":"Decrease hidden influence material weight from 10 to 8","timestamp":1778371026160,"segment":0,"confidence":2.375,"asi":{"hypothesis":"More aggressive coin/action valuation by lowering influence weight might convert more games into wins.","rollback_reason":"Primary strength_score fell from 99 to 87, mainly collapsing 4p_random wins; reduced influence weight over-aggresses or undervalues survival.","next_action_hint":"Leave influence weight at 10; tune move heuristics or selection rather than broad material scaling."}}
{"run":6,"commit":"e70718a","metric":97,"metrics":{"games":220,"timeouts":19,"decisions":6205,"bench_elapsed_ms":907},"status":"discard","description":"Increase coup-pressure eval bonuses from 5/8 to 7/12","timestamp":1778371045396,"segment":0,"confidence":3.8,"asi":{"hypothesis":"Stronger bonus for having enough coins to coup could improve urgency around coup threats after the initial 5/8 bonus helped.","rollback_reason":"Primary strength_score fell from 99 to 97; 4p heuristic did not improve and 4p random stayed below the 5/8 version.","next_action_hint":"Current 7+=5 and 10+=8 coup-pressure bonuses are close to better; test smaller/lower values or asymmetric opponent threat penalties if continuing eval tuning."}}
{"run":7,"commit":"e70718a","metric":97,"metrics":{"games":220,"timeouts":16,"decisions":6209,"bench_elapsed_ms":911},"status":"discard","description":"Decrease coup-pressure eval bonuses from 5/8 to 3/5","timestamp":1778371056201,"segment":0,"confidence":6.333333333333333,"asi":{"hypothesis":"A milder coup-threshold bonus might keep the previous h2h/heuristic benefits without overcommitting to coup pressure.","rollback_reason":"Primary strength_score fell from 99 to 97; 4p random improved but 4p heuristic dropped to 14/60.","next_action_hint":"Coup pressure creates tradeoffs between random and heuristic opponents; consider opponent-specific threat terms or rollout heuristic scoring rather than simple global bonus size."}}
{"run":8,"commit":"e70718a","metric":98,"metrics":{"games":220,"timeouts":20,"decisions":5937,"bench_elapsed_ms":866},"status":"discard","description":"Raise heuristic rollout Coup base score from 80 to 100","timestamp":1778371068945,"segment":0,"confidence":9.5,"asi":{"hypothesis":"Heuristic rollouts may under-prioritize guaranteed coups; raising Coup score could make search rollouts resolve threats more decisively.","rollback_reason":"Primary strength_score fell from 99 to 98; h2h dropped by 2 wins while 4p gains were insufficient.","next_action_hint":"Coup is already prioritized enough by base 80 plus eval coup-pressure; avoid increasing direct Coup heuristic globally."}}
{"run":9,"commit":"e70718a","metric":98,"metrics":{"games":220,"timeouts":17,"decisions":5900,"bench_elapsed_ms":836},"status":"discard","description":"Lower heuristic rollout Coup base score from 80 to 70","timestamp":1778371079942,"segment":0,"confidence":19,"asi":{"hypothesis":"The eval coup-pressure bonus may make direct Coup heuristic over-prioritized; lowering base Coup might improve setup play and h2h.","rollback_reason":"Primary strength_score fell from 99 to 98 despite h2h improving to 47; both 4-player workloads worsened.","next_action_hint":"Coup base 80 balances multiplayer better; h2h-specific improvement suggests future multi-objective tuning may need separate benchmark weighting."}}
{"run":10,"commit":"e70718a","metric":98,"metrics":{"games":220,"timeouts":21,"decisions":6056,"bench_elapsed_ms":865},"status":"discard","description":"Choose final ISMCTS move by visit count instead of mean reward","timestamp":1778371095908,"segment":0,"confidence":19,"asi":{"hypothesis":"Robust-child selection by visit count may be less noisy than mean-reward final choice at only 60 iterations.","rollback_reason":"Primary strength_score fell from 99 to 98; 4p random improved but 4p heuristic and h2h worsened.","next_action_hint":"Mean reward final selection is better for this low-iteration benchmark; if revisiting, try hybrid visit threshold or lower-confidence penalized mean."}}
{"run":11,"commit":"e70718a","metric":92,"metrics":{"games":220,"timeouts":19,"decisions":8630,"bench_elapsed_ms":707},"status":"discard","description":"Remove random jitter from heuristic rollout move scoring","timestamp":1778371114964,"segment":0,"confidence":19,"asi":{"hypothesis":"Heuristic rollout noise may degrade search estimates; deterministic scoring could make rollouts more consistent.","rollback_reason":"Primary strength_score fell from 99 to 92. H2h improved strongly, but both 4-player workloads collapsed; jitter appears important for diverse multi-player rollouts and avoiding legal-order bias.","next_action_hint":"Keep small jitter. If tuning, vary jitter magnitude or tie-breaking only; don't remove stochasticity entirely."}}
{"run":12,"commit":"e70718a","metric":81,"metrics":{"games":220,"timeouts":28,"decisions":8815,"bench_elapsed_ms":909},"status":"discard","description":"Increase heuristic rollout score jitter range from 0..4 to 0..8","timestamp":1778371124986,"segment":0,"confidence":9.5,"asi":{"hypothesis":"More stochasticity in heuristic rollout tie/near-tie scoring might broaden exploration and avoid brittle deterministic choices.","rollback_reason":"Primary strength_score nearly returned to baseline (81), with h2h and 4p heuristic much worse and more timeouts.","next_action_hint":"Do not increase jitter above 0..4; excessive rollout noise overwhelms heuristic signal."}}
{"run":13,"commit":"e70718a","metric":75,"metrics":{"games":220,"timeouts":32,"decisions":11585,"bench_elapsed_ms":785},"status":"discard","description":"Decrease heuristic rollout score jitter range from 0..4 to 0..2","timestamp":1778371134119,"segment":0,"confidence":6.333333333333333,"asi":{"hypothesis":"Slightly less rollout stochasticity might keep useful diversity while reducing noisy move choices.","rollback_reason":"Primary strength_score fell below baseline to 75, with many more timeouts and poor 4-player win counts.","next_action_hint":"The original 0..4 jitter magnitude is a local optimum for this workload; avoid further jitter magnitude tuning unless changing tie-breaking architecture."}}
{"run":14,"commit":"e70718a","metric":87,"metrics":{"games":220,"timeouts":24,"decisions":5942,"bench_elapsed_ms":861},"status":"discard","description":"Add root eval bonus for each eliminated opponent","timestamp":1778371158823,"segment":0,"confidence":4.222222222222222,"asi":{"hypothesis":"Average-opponent evaluation may fail to reward progress from eliminating non-root players in multiplayer games; a bonus per eliminated opponent might encourage closing games.","rollback_reason":"Primary strength_score fell from 99 to 87 across all workloads; the bonus appears to distort nonterminal values or encourage bad aggression.","next_action_hint":"Do not add explicit eliminated-opponent bonus. Terminal reward and material/coup pressure are sufficient; focus on action policy/eval threat details."}}
{"run":15,"commit":"e70718a","metric":85,"metrics":{"games":220,"timeouts":21,"decisions":7325,"bench_elapsed_ms":854},"status":"discard","description":"Increase nonterminal eval sensitivity by changing denominator from 100 to 80","timestamp":1778371169241,"segment":0,"confidence":3.1666666666666665,"asi":{"hypothesis":"A steeper material-to-reward mapping may make rollout evaluations distinguish good states more clearly.","rollback_reason":"Primary strength_score fell from 99 to 85; steeper eval hurt both 4-player workloads badly.","next_action_hint":"Do not make eval more extreme; if tuning scale, try a flatter denominator or non-linear terms with care."}}
{"run":16,"commit":"e70718a","metric":90,"metrics":{"games":220,"timeouts":22,"decisions":7547,"bench_elapsed_ms":877},"status":"discard","description":"Flatten nonterminal eval sensitivity by changing denominator from 100 to 120","timestamp":1778371180681,"segment":0,"confidence":3.1666666666666665,"asi":{"hypothesis":"A flatter material-to-reward mapping may avoid overreacting to noisy intermediate states in imperfect information rollouts.","rollback_reason":"Primary strength_score fell from 99 to 90. 4p heuristic improved slightly, but 4p random collapsed and h2h dipped.","next_action_hint":"Denominator 100 is better aggregate; flatter eval is only promising if specifically optimizing 4p vs heuristic."}}
{"run":17,"commit":"e70718a","metric":98,"metrics":{"games":220,"timeouts":24,"decisions":6090,"bench_elapsed_ms":876},"status":"discard","description":"Double target coin weight in heuristic attack target scoring","timestamp":1778371191950,"segment":0,"confidence":3.1666666666666665,"asi":{"hypothesis":"Attack actions should prioritize rich opponents more because high coins represent coup threats; target_score may underweight target coins.","rollback_reason":"Primary strength_score fell from 99 to 98. H2h improved and 4p heuristic nearly held, but 4p random lost enough to miss aggregate best and timeouts increased.","next_action_hint":"Higher target coin weighting is a possible h2h/heuristic idea but not aggregate-best; consider a smaller 1.5x integer approximation or threat threshold bonus."}}
{"run":18,"commit":"e70718a","metric":80,"metrics":{"games":220,"timeouts":24,"decisions":7393,"bench_elapsed_ms":860},"status":"discard","description":"Add target threat bonus when attack target has 7+ coins","timestamp":1778371203420,"segment":0,"confidence":2.923076923076923,"asi":{"hypothesis":"Targeting opponents who can coup soon should improve defensive attack selection without over-weighting every coin.","rollback_reason":"Primary strength_score fell from 99 to 80, wiping out all retained gains in the benchmark.","next_action_hint":"Do not add simple target coin-threshold bonuses in rollout scoring; they appear to distort target selection badly."}}
{"run":19,"commit":"9a2a0fc","metric":103,"metrics":{"games":220,"timeouts":20,"decisions":6299,"bench_elapsed_ms":945},"status":"keep","description":"Select final ISMCTS move by total accumulated reward","timestamp":1778371232217,"segment":0,"confidence":3.8333333333333335,"asi":{"hypothesis":"At low iteration counts, final mean reward can overfit sparsely visited lucky moves, while visit count alone lost value signal; total reward may better combine confidence and payoff.","learning":"New best strength_score=103. It improves all three workload components over current best: 4p_random 36, 4p_heuristic 21, h2h 46. Runtime/decisions rose moderately but primary strength improved."}}
{"run":20,"commit":"9a2a0fc","metric":95,"metrics":{"games":220,"timeouts":18,"decisions":7388,"bench_elapsed_ms":843},"status":"discard","description":"Use parent node visits instead of edge availability in ISMCTS UCB exploration term","timestamp":1778371250681,"segment":0,"confidence":4.6,"asi":{"hypothesis":"Standard UCT uses parent visit count in the exploration logarithm; replacing ISMCTS availability count might improve low-iteration exploration.","rollback_reason":"Primary strength_score fell from 103 to 95, mostly from h2h dropping to even and 4p heuristic losing wins.","next_action_hint":"Keep availability-based exploration for ISMCTS; it better handles imperfect-information move availability than parent visits."}}
{"run":21,"commit":"9a2a0fc","metric":91,"metrics":{"games":220,"timeouts":21,"decisions":6167,"bench_elapsed_ms":866},"status":"discard","description":"Compare eval root material against strongest living opponent instead of average opponent","timestamp":1778371267167,"segment":0,"confidence":3.8333333333333335,"asi":{"hypothesis":"In multiplayer Coup, beating the strongest remaining opponent may matter more than average opponent material; max-opponent comparison could improve threat awareness.","rollback_reason":"Primary strength_score fell from 103 to 91, with 4p random especially poor.","next_action_hint":"Average opponent material remains better than strongest-opponent material; max threat focus likely over-defensive in multiplayer."}}
{"run":22,"commit":"9a2a0fc","metric":102,"metrics":{"games":220,"timeouts":27,"decisions":7502,"bench_elapsed_ms":852},"status":"discard","description":"Model non-root players with random moves during ISMCTS tree simulation","timestamp":1778371285184,"segment":0,"confidence":4.6,"asi":{"hypothesis":"Because one benchmark component has random opponents, using random non-root moves in tree simulation may prevent overestimating heuristic opponent strength and improve exploitation.","rollback_reason":"Primary strength_score fell slightly from 103 to 102. It massively improved 4p_random (55 wins) but collapsed 4p_heuristic and h2h, so not aggregate-best.","next_action_hint":"Opponent model choice is highly workload-sensitive. Keep configured heuristic opponent model for aggregate; a future adaptive opponent model could switch based on observed opponent behavior."}}
{"run":23,"commit":"9a2a0fc","metric":95,"metrics":{"games":220,"timeouts":27,"decisions":7449,"bench_elapsed_ms":834},"status":"discard","description":"Mix 25% random opponent moves into ISMCTS non-root simulation","timestamp":1778371297469,"segment":0,"confidence":5.75,"asi":{"hypothesis":"A mixed opponent model could capture both random and heuristic benchmark opponents better than all-heuristic or all-random non-root simulation.","rollback_reason":"Primary strength_score fell from 103 to 95; h2h suffered and timeouts rose. A fixed stochastic mix does not balance workloads well.","next_action_hint":"If pursuing opponent modeling, try explicit opponent inference rather than random mixing inside every simulation."}}
{"run":24,"commit":"bf249c1","metric":110,"metrics":{"games":220,"timeouts":26,"decisions":6979,"bench_elapsed_ms":754},"status":"keep","description":"Raise balanced heuristic challenge base score from 12 to 18","timestamp":1778375978734,"segment":0,"confidence":6.666666666666667,"asi":{"hypothesis":"Balanced rollouts were too reluctant to challenge plausible but valuable claims because PassChallenge=25 beats many challenge scores; a modest base increase should better punish bluffs without making impossible-claim logic brittle.","learning":"New best strength_score=110. The gain is concentrated in 4p vs heuristic (21→28 wins) while 4p random improves slightly and h2h falls from 46 to 44. More timeouts, but primary improvement is large."}}
{"run":25,"commit":"cc45e7d","metric":114,"metrics":{"games":220,"timeouts":22,"decisions":6766,"bench_elapsed_ms":639},"status":"keep","description":"Increase heuristic challenge base further from 18 to 22","timestamp":1778375993590,"segment":0,"confidence":6.8,"asi":{"hypothesis":"The previous challenge-base increase helped, so a slightly more skeptical rollout policy may catch additional bluffs and improve action denial without over-challenging.","learning":"New best strength_score=114. 4p random and h2h both improve substantially, while 4p heuristic gives back the prior spike (28→21) but remains at the old best component level. Aggregate and timeouts both improve vs 18."}}
{"run":26,"commit":"76054c6","metric":123,"metrics":{"games":220,"timeouts":30,"decisions":6666,"bench_elapsed_ms":627},"status":"keep","description":"Increase heuristic challenge base from 22 to 26","timestamp":1778376005149,"segment":0,"confidence":7.166666666666667,"asi":{"hypothesis":"Challenge scoring may still be too passive relative to PassChallenge=25; setting the base to 26 makes most valuable claimed actions contestable unless the player is at one influence.","learning":"Large new best strength_score=123. 4p heuristic returns to 28 wins and h2h jumps to 55; 4p random remains strong. Timeouts rise to 30, but primary improvement is large."}}
{"run":27,"commit":"9b80d44","metric":125,"metrics":{"games":220,"timeouts":28,"decisions":4853,"bench_elapsed_ms":478},"status":"keep","description":"Increase heuristic challenge base from 26 to 30","timestamp":1778376015556,"segment":0,"confidence":7.5,"asi":{"hypothesis":"A still more skeptical heuristic rollout may improve multiplayer by aggressively contesting claims, while risk_penalty still tempers one-influence challenges.","learning":"New best strength_score=125. 4p random improves strongly and 4p heuristic holds at 28; h2h falls from 55 to 49 but aggregate is higher and decisions/time improve."}}
{"run":28,"commit":"3381aad","metric":135,"metrics":{"games":220,"timeouts":33,"decisions":4578,"bench_elapsed_ms":421},"status":"keep","description":"Increase heuristic challenge base from 30 to 34","timestamp":1778376027159,"segment":0,"confidence":8.461538461538462,"asi":{"hypothesis":"The benchmark keeps rewarding more skeptical challenge behavior; increasing base to 34 may further exploit bluff-heavy random/heuristic play while preserving risk penalty.","learning":"New best strength_score=135, with large 4p random and h2h gains and only a small 4p heuristic win drop. Timeouts rise to 33 but decisive rates improve substantially."}}
{"run":29,"commit":"63eb032","metric":142,"metrics":{"games":220,"timeouts":29,"decisions":4595,"bench_elapsed_ms":385},"status":"keep","description":"Increase heuristic challenge base from 34 to 38","timestamp":1778376039259,"segment":0,"confidence":8.857142857142858,"asi":{"hypothesis":"More skeptical challenge scoring still appears to improve all components; base 38 may better reflect that false claims are common in random/heuristic play and high-impact actions deserve contesting.","learning":"New best strength_score=142. All three components improved over base 34 (4p_random 54, 4p_heuristic 31, h2h 57) and timeouts decreased vs prior best."}}
{"run":30,"commit":"1d77f65","metric":157,"metrics":{"games":220,"timeouts":29,"decisions":4487,"bench_elapsed_ms":377},"status":"keep","description":"Increase heuristic challenge base from 38 to 42","timestamp":1778376052248,"segment":0,"confidence":9.625,"asi":{"hypothesis":"The challenge base is still below the value where over-challenging dominates; pushing to 42 should contest nearly all meaningful claimed actions while still accounting for one-influence risk.","learning":"Major new best strength_score=157. Every component improves: 4p_random 56, 4p_heuristic 38, h2h 63, with stable timeouts and faster benchmark time."}}
{"run":31,"commit":"1d77f65","metric":155,"metrics":{"games":220,"timeouts":29,"decisions":4567,"bench_elapsed_ms":361},"status":"discard","description":"Increase heuristic challenge base from 42 to 48","timestamp":1778376064537,"segment":0,"confidence":8.555555555555555,"asi":{"hypothesis":"Since challenge base 42 improved sharply, a larger jump to 48 might further exploit frequent false claims and improve h2h.","rollback_reason":"Primary strength_score fell from 157 to 155. H2h improved to 68, but both 4-player workloads declined, so 48 over-challenges for multiplayer aggregate.","next_action_hint":"Challenge base optimum is near 42 for aggregate. If tuning further, try local values around 40-44 rather than large increases."}}
