{"run":32,"commit":"1d77f65","metric":152,"metrics":{"games":220,"timeouts":31,"decisions":4382,"bench_elapsed_ms":348},"status":"discard","description":"Increase heuristic challenge base from 42 to 44","timestamp":1778376074612,"segment":0,"confidence":7.7,"asi":{"hypothesis":"A small increase above 42 may retain multiplayer strength while improving h2h challenge aggression.","rollback_reason":"Primary strength_score fell from 157 to 152. H2h improved, but both 4-player components declined and timeouts rose.","next_action_hint":"42 is better than nearby higher values; try 40 or tune risk/impact terms instead of increasing base."}}
{"run":33,"commit":"1d77f65","metric":142,"metrics":{"games":220,"timeouts":34,"decisions":4459,"bench_elapsed_ms":370},"status":"discard","description":"Decrease heuristic challenge base from 42 to 40","timestamp":1778376084865,"segment":0,"confidence":7,"asi":{"hypothesis":"A slightly lower value than 42 might reduce over-challenging in multiplayer while keeping most of the challenge-aggression gains.","rollback_reason":"Primary strength_score fell sharply from 157 to 142 and timeouts rose; despite strong 4p random decisive rate, 4p heuristic and h2h worsened.","next_action_hint":"Challenge base 42 is a local optimum among 40/42/44/48; move to different scoring dimensions."}}
{"run":34,"commit":"1d77f65","metric":132,"metrics":{"games":220,"timeouts":27,"decisions":4860,"bench_elapsed_ms":451},"status":"discard","description":"Increase one-influence challenge risk penalty from 20 to 30","timestamp":1778376098777,"segment":0,"confidence":7,"asi":{"hypothesis":"After raising challenge base to 42, one-influence players may over-challenge; a larger risk penalty could preserve skepticism while avoiding suicidal challenges.","rollback_reason":"Primary strength_score fell from 157 to 132 across all components. The stronger risk penalty makes the policy too passive in critical late-game spots.","next_action_hint":"Keep one-influence challenge risk penalty at 20. If adjusting risk, try lower penalty rather than higher."}}
{"run":35,"commit":"1d77f65","metric":154,"metrics":{"games":220,"timeouts":29,"decisions":4547,"bench_elapsed_ms":362},"status":"discard","description":"Decrease one-influence challenge risk penalty from 20 to 10","timestamp":1778376110097,"segment":0,"confidence":7,"asi":{"hypothesis":"The current risk penalty may still make late-game players too passive; lower penalty could improve h2h and decisive challenges.","rollback_reason":"Primary strength_score fell from 157 to 154. H2h improved to 68, but 4-player workloads declined enough to lose aggregate.","next_action_hint":"Risk penalty 20 is best aggregate; lower risk is h2h-favorable but multiplayer-worse, similar to challenge base >42."}}
{"run":36,"commit":"4b141b9","metric":162,"metrics":{"games":220,"timeouts":27,"decisions":4517,"bench_elapsed_ms":361},"status":"keep","description":"Add challenge scarcity bonus when two copies of claimed card are visible","timestamp":1778376133395,"segment":0,"confidence":7.130434782608695,"asi":{"hypothesis":"When a player can see two copies of a claimed card, the claim is much less likely to be true; challenge scoring should account for card scarcity rather than only impossible three-visible claims.","learning":"New best strength_score=162. 4p_random jumps to 62 and h2h to 66; 4p_heuristic drops from 38 to 34 but aggregate improves and timeouts fall."}}
{"run":37,"commit":"4b141b9","metric":160,"metrics":{"games":220,"timeouts":27,"decisions":4493,"bench_elapsed_ms":356},"status":"discard","description":"Increase two-visible-card challenge scarcity bonus from 18 to 30","timestamp":1778376145896,"segment":0,"confidence":6.833333333333333,"asi":{"hypothesis":"The two-visible-card scarcity signal is strong, so a larger bonus might improve challenge decisions when claims are unlikely but not impossible.","rollback_reason":"Primary strength_score fell from 162 to 160; 4p random stayed high but 4p heuristic and h2h each lost a little.","next_action_hint":"Scarcity bonus 18 is better than 30; try a smaller local adjustment or leave it."}}
